{
    "entity_type": "projectile",
    "speed": {
        "value": 500.0,
        "unit": "m/s"
    },
    "damage": {
        "value": 10.0,
        "unit": "hp"
    },
    "lifetime": {
        "value": 2.0,
        "unit": "s"
    },
    "radius": {
        "value": 0.1,
        "unit": "m"
    }
}
